{
  "schemaVersion": "finance-harness-asset-change-proposal.v1",
  "proposalId": "proposal-0123456789abcdef",
  "status": "proposed",
  "catalog": {
    "schemaVersion": "finance-asset-catalog.v1",
    "catalogVersion": "0.2.6",
    "catalogRevision": "2026-09-14.shared-task-1",
    "harnessRevision": "c224c9a109812cdf186ee7c709cd2dd463783b8a",
    "source": "catalog/finance-assets.v1.json",
    "digest": "sha256:c0a5579705bc118f94e9bb41f213d513a7dfcc3026ed85bd62908a98625c67b6"
  },
  "target": {
    "kind": "domain-pack",
    "id": "wealth-employee-assisted",
    "version": "0.1.0",
    "source": "repo://domain-packs/wealth/employee-assisted",
    "digest": "sha256:aaaaaaaaaaaaaaaaaaaaaaaaaaaaaaaaaaaaaaaaaaaaaaaaaaaaaaaaaaaaaaaa",
    "governanceRef": "finance-harness-core",
    "owner": "finance-harness-maintainers"
  },
  "parentLock": {
    "solutionId": "wealth-manager-previsit-demo",
    "lockDigest": "bbbbbbbbbbbbbbbbbbbbbbbbbbbbbbbbbbbbbbbbbbbbbbbbbbbbbbbbbbbbbbbb"
  },
  "finding": {
    "id": "finding-domain-pack-001",
    "category": "solution-assets",
    "summary": "The published domain guidance requires owner review.",
    "evidenceRefs": [
      {
        "kind": "workspace-path",
        "locator": "evidence/evaluation-report.json",
        "sha256": "cccccccccccccccccccccccccccccccccccccccccccccccccccccccccccccccc"
      }
    ]
  },
  "reproduction": {
    "conditions": [
      "Use the frozen evaluation snapshot referenced by the parent report."
    ],
    "redaction": "public-safe"
  },
  "proposedChange": {
    "summary": "Review the affected guidance and publish a new immutable asset version.",
    "scopes": [
      "implementation",
      "tests"
    ]
  },
  "verification": {
    "entrypoint": "mvn -q test",
    "priorResultRefs": [
      {
        "kind": "workspace-path",
        "locator": "evidence/evaluation-report.json",
        "sha256": "cccccccccccccccccccccccccccccccccccccccccccccccccccccccccccccccc"
      }
    ]
  },
  "builderTask": {
    "taskId": "wealth-manager-previsit-build",
    "sourceRevision": "b5041157461d2c09732412272a028bdc957b4e1d"
  },
  "createdAt": "2026-09-10T11:30:00Z"
}
